{
  "product_name": "Acme Platform",
  "version": "2.4.0",
  "release_date": "2026-02-16",
  "summary": "This release introduces the new real-time collaboration engine, improves dashboard performance by 40%, and resolves several critical authentication bugs.",
  "features": [
    { "title": "Real-time Collaboration Engine", "description": "Multiple users can edit documents simultaneously with live cursor tracking." },
    { "title": "Dashboard Performance Overhaul", "description": "Load times reduced from 3.2s to 0.8s on average." },
    { "title": "Bulk Export API", "description": "New endpoint supports exporting up to 10,000 records in a single request." }
  ],
  "fixes": [
    { "id": "BUG-1042", "title": "SSO token refresh loop", "description": "Fixed infinite redirect when SAML tokens expired." },
    { "id": "BUG-1058", "title": "CSV export encoding", "description": "Resolved UTF-8 BOM handling for Excel compatibility." }
  ],
  "breaking_changes": [
    { "title": "Removed /v1/users endpoint", "description": "Migrate to /v2/users with pagination support.", "migration": "Replace /v1/users with /v2/users?fields=id,name&limit=50" }
  ],
  "links": [
    { "label": "Full Changelog", "url": "https://github.com/acme/platform/compare/v2.3.0...v2.4.0" },
    { "label": "Migration Guide", "url": "https://docs.acme.io/migrations/2.4.0" }
  ]
}
