{
  "product_name": "Plataforma Acme (æ—¥æœ¬èªãƒ†ã‚¹ãƒˆ)",
  "version": "3.0.0-beta.1",
  "release_date": "2026-02-16",
  "summary": "Cette version ajoute le support multilingue â€” Ğ²ĞºĞ»ÑÑ‡Ğ°Ñ Ñ€ÑƒÑÑĞºĞ¸Ğ¹, ä¸­æ–‡, Ø§Ù„Ø¹Ø±Ø¨ÙŠØ©, und Deutsch. Emojis: ğŸš€ğŸ“ŠğŸ”’",
  "features": [
    { "title": "Internationalisation (i18n)", "description": "Support fÃ¼r 12 Sprachen: English, FranÃ§ais, Deutsch, æ—¥æœ¬èª, ä¸­æ–‡, í•œêµ­ì–´, EspaÃ±ol, PortuguÃªs, Ğ ÑƒÑÑĞºĞ¸Ğ¹, Ø§Ù„Ø¹Ø±Ø¨ÙŠØ©, à¤¹à¤¿à¤¨à¥à¤¦à¥€, Bahasa Indonesia" },
    { "title": "Symboles spÃ©ciaux & caractÃ¨res", "description": "Gestion correcte des caractÃ¨res: <, >, &, \", ', Â©, Â®, â„¢, â‚¬, Â£, Â¥, Â§, Â¶, â€ , â€¡, â€°, â„–" }
  ],
  "fixes": [
    { "id": "BUG-æ—¥æœ¬", "title": "Encodage UTF-8 cassÃ© pour les noms de fichiers", "description": "Les fichiers avec des caractÃ¨res non-ASCII dans le nom Ã©taient corrompus lors du tÃ©lÃ©chargement." }
  ],
  "breaking_changes": [
    { "title": "Format de date changÃ© en ISO 8601", "description": "Tous les champs de date utilisent maintenant le format ISO 8601 (YYYY-MM-DD).", "migration": "Mettez Ã  jour votre parseur de dates pour accepter le format ISO 8601." }
  ],
  "links": [
    { "label": "Guide de migration ç§»è¡Œã‚¬ã‚¤ãƒ‰", "url": "https://docs.acme.io/i18n/migration" }
  ]
}
